id,question,problem_type
256,"As an Information Security Analyst, you need to secure and protect the computer systems, networks, and data from cyber threats, attacks, and breaches by implementing security measures, protocols, and technologies. Imagine that you have been tasked with analyzing the relationships between common adjectives and nouns in a literary work stored in a GML file. Your objective is to apply the Paris algorithm in cdlib to perform hierarchical clustering of the graph. After clustering, you are required to convert the clustering information to JSON format and present it for further analysis.",calculations
257,"Imagine you are at a plastic surgery conference, attending a workshop about the socioeconomic factors influencing cosmetic procedures. During a compelling presentation, the speaker illustrates a fascinating point by referencing the Zipfian principle—an observation that certain phenomena follow a distribution where the frequency of an event is inversely proportional to its rank. This piques your interest, given your in-depth focus on aesthetics and proportions.Eager to apply this to your own studies on the popularity of procedures, you decide to model patient requests for various treatments. To mimic this distribution, you realize that NetworkX can aid you in generating a random number that would simulate the rank of a particular surgery according to the Zipf's law, with a specific skewness resembling the real-world data where more common procedures occur more frequently.You'll want to conduct a quantitatively controlled experiment where the randomness is consistent for comparative analysis. This requires you to set an initial randomness value or 'seed' to ensure that your simulation can be replicated with preciseness in successive trials for reliable, unbiased results.Concretely, could you provide guidance on how one might execute a command using NetworkX's utilities that draws a random integer conforming to a Zipfian distribution characterized by a steepness factor of 2.5 and a minimum value of 3, while establishing reproducibility through fixing the randomness seed at 42? This experiment aims to forecast the demand for different cosmetic procedures in your clinic, offering valuable insight for resource allocation and marketing strategies.",calculations
258,"As an abacus tutor, you may come across a scenario where you need to demonstrate the use of an abacus to a class of students with varying skill levels. In this particular case, your students are divided into two categories: those with significant prior experience (True) and those with little to no experience (False). To aid in your demonstration, you would need to calculate the size of the projections for the two types of students, which includes the number of vertices and edges. This calculation can be achieved using the bipartite_projection_size function in the igraph API. The specific edge set and node types provided can be used to perform this calculation.",calculations
259,"As a real estate developer overseeing the development of a new residential community, you have a graph representation of the proposed neighborhood layout. The graph consists of connections between different lots, indicating proximity and potential interactions between future residents. Using igraph's implementation of Newman's eigenvector community structure detection method, you want to analyze the graph to identify natural groupings within the community. By doing so, you aim to gain insights to inform various aspects of the project, such as amenities placement, neighborhood design, and targeted marketing strategies.",calculations
260,"Imagine you're in the studio preparing for an intricate glassblowing project that involves a series of interconnected chambers representing different stages in the creation of a glass sculpture. The chambers are named x, a, b, c, d, e, and y, each symbolizing a critical step in the glassblowing process. The pathways between these chambers can only tolerate a certain volume of glass before becoming too full to function properly.For visualization, the chamber 'x' is the initial fire chamber where the process begins. Think of your raw materials flowing from 'x' to 'a' and 'b' with maximum capacities of 3.0 and 1.0 units, respectively. Similarly, chamber 'a' can send 3.0 units towards 'c', and the route from 'b' to 'c' can withstand up to 5.0 units. Also, 'b' has another path to 'd' that can handle 4.0 units, while 'd' leads to the final chamber 'e' with a 2.0 unit capacity. Lastly, 'c' and 'e' have pathways directing to the finishing point 'y' with maximum capacities of 2.0 and 3.0 units, respectively.To maintain the integrity of your glass piece, it's crucial to know the minimum capacity at which the glass flow through the chambers would need to be restricted to avoid overburdening any part of the network, ensuring your sculpture turns out flawless. This is synonymous with identifying the minimum cut in your studio's chamber network between the initial fire chamber 'x' and the final chamber 'y'. How would you determine this vital threshold to safeguard the quality of your creation?",calculations
261,"As a Color Consultant, I often assist clients in selecting the perfect color schemes for their homes or businesses, ensuring harmony and visual appeal in their spaces. Recently, I've been approached by a group of interior designers working on a collaborative project to revamp a series of co-working spaces in a metropolitan area. They're seeking my expertise in color coordination to create distinct yet cohesive environments within each space.To streamline our decision-making process, we've decided to utilize a network analysis approach, leveraging the Political blogs Graph stored in a GML file named polblogs.gml. Our goal is to identify communities within this network, each representing a cohesive group of political blogs that share common themes or affiliations.To achieve this, we plan to utilize the COACH function from the cdlib library, a powerful tool for community detection in networks. Once we've applied the algorithm, we'll generate a JSON representation of the detected communities, providing us with a clear understanding of the blog networks and their relationships.By incorporating network analysis techniques into our color consultation process, we aim to derive insights that will inform our color palette selections, ensuring that each co-working space reflects the diverse yet interconnected nature of the political blogosphere while maintaining aesthetic appeal and visual coherence.",calculations
262,"Imagine you're overseeing a promotional campaign for a new product, where the flow of information is akin to a network of contacts passing along the message. You have a list showing who has been contacting whom, depicted as directed connections: Person 1 reaches out to Person 2, then Person 2 to Person 3, and so on, creating a sequence of contacts (1 to 2, 2 to 3, 3 to 4, 2 to 4, 3 to 1).To refine your strategy and maximize the effectiveness of your campaign, you want to analyze the pattern of communication in this network. Specifically, you are interested in assessing how frequently well-connected influencers are reaching out to those who are equally central or peripheral in receiving information.In technical terms, you're asking for the calculation of the degree assortativity coefficient, considering the 'out' degree (akin to how much an individual is reaching out or 'promoting') of the source contacts and the 'in' degree (akin to how much an individual is being targeted or 'marketed to') of the target contacts. This measurement will help you understand the propensity of similar-level influencers and targets to connect within your promotional network, thereby giving you insights on how to adjust your marketing tactics.",calculations
263,"Imagine you are working on an AI project where you need to optimize resource allocation within a complex system. You've modeled the system as a bipartite graph with two distinct sets of resources. The first set includes resources labeled 1, 2, 3, and 4, and the second set comprises resources labeled 'a', 'b', 'c', and 'd'. Connections between these resources have been established such that resources 1 and 2 can interface with 'a' and 'b', resources 2 and 3 with 'b' and 'c', and resource 4 with 'd' exclusively.Your objective now is to determine the smallest set of these resources essential to maintain the full range of functionality offered by these interfaces. Specifically, using NetworkX's `to_vertex_cover` function, can you compute the minimum vertex cover of this bipartite graph? This operation is critical as it will enable you to streamline the system, ensuring efficiency without compromising on performance.",calculations
264,"As a Green Architect, you're working on a project to design an environmentally friendly community center. You have a list of tuples representing connections between different areas within the community center, along with the associated weights. You're interested in creating an undirected, weighted graph using igraph's `Graph.TupleList` function to visualize the relationships between the areas. Additionally, you want to calculate the average clustering coefficient of this graph using NetworkX to assess the level of connectivity and interaction within the community center.",calculations
265,"Imagine we're mapping out the connections between a group of five up-and-coming stars within the bustling network of the entertainment industry, where everyone knows everyone - a perfect ensemble, if you will. Now picture nodes 0 and 1 as two actors who've recently made a splash on the scene, and nodes 2 and 3 as a pair of musicians who've been hitting all the right notes in the industry.Your mission, should you choose to accept it, involves calculating the score which determines just how beneficial it might be for these duos to collaborate, based on their mutual connections within this tight-knit community. This 'star-power' score, if you will, is formally known as the Common Neighbor and Centrality based Parameterized Algorithm (CCPA) score. I need you to work your magic with an alpha value of 0.8, which in our world is akin to the level of influence these common connections have on the potential success of their partnership. What I'm after are the CCPA scores for the actor duo (0,1) and the musician pair (2,3). These figures will help us understand the potential synergy between these talents if they were to team up for a project or an event.With your insider know-how and this calculation at hand, we'll be able to steer these artists' careers in the right direction by leveraging their shared networks. The question is, with the connections they already have, just how beneficial are they to each other? What are these CCPA scores for our duos within this star-studded graph?",calculations
266,"Suppose you are a Disaster Recovery Specialist who is currently working on developing a resilient communication network among your response teams, designated as nodes 1 through 5. To enhance the effectiveness of this communication network, you are interested in identifying which nodes are most critical for information flow, considering not only direct but also indirect connections.You have a network laid out where team 1 can communicate directly with teams 2 and 3, team 2 can also connect with team 3, team 3 with team 4, and team 4 with team 5, forming a set of edges: [(1, 2), (1, 3), (2, 3), (3, 4), (4, 5)]. Your objective is to utilize the second_order_centrality function from the networkx library to compute the second order centrality values, reflecting the importance of each team within the network.Can you proceed with this analysis and display the results in the following manner, substituting the computed values where appropriate?```pythonfor node, centrality in soc.items():    print(f""Node {node}: {centrality}"")```This information is paramount to understanding how to maintain robustness in the communication flow, ensuring that in the face of any disruptions, the network remains operational with minimal impact on disaster recovery efforts.",calculations
267,"Imagine you're a nutrition coach overseeing a research project where you have 100 different food samples, and each food sample is characterized by 3 nutritional components (let's say, for example, fat content, protein content, and fiber content). These nutritional components' data points are collected in a neatly organized table much like a menu of dishes, represented mathematically by what we call a numpy array labeled 'X' with a size of 100 rows for the samples and 3 columns for the elements.To get a deeper understanding of the patterns within this array of nutritional data, you're considering using a sophisticated tool from the realm of data science called 'GaussianCluster' from the 'graspologic' API. This tool can group the food samples into clusters based on similarities in their nutritional makeup.You're particularly focused on identifying the optimal number of these clusters. Just as you might modify a client's diet to find the right balance, GaussianCluster can try various cluster arrangements. You seek to pinpoint the most fitting structure by minimizing something known as the Bayesian Information Criterion (BIC) - a criterion that balances the goodness of the model fit with the simplicity to avoid overcomplicating the diet plan, so to speak.However, the way in which you evaluate the variance of these nutritional components within your clusters can be done using different methods, akin to how you might consider different dietary needs for different individuals. These methods are called covariance types, and GaussianCluster is versatile enough to consider each one.Your question to the research team, then, would be about using this GaussianCluster tool to assess which setup works best. Specifically, how can they deploy GaussianCluster to explore the clustering configuration of the data, testing out different numbers of groups ranging from 2 to 5 (much like testing different meal plans), while evaluating all possible covariance types to ultimately minimize the BIC for the most effective dietary pattern analysis.",calculations
268,"As a Respiratory Therapist deeply engaged in the understanding of networks within the pulmonary system, imagine translating this concept to a social structure, specifically a Karate Club, where each member is akin to an alveolus and their relationships are the bronchioles connecting them. In this scenario, you're exploring methodologies akin to diagnosing the interactions and efficiencies between different parts of the respiratory network. How would you employ a method similar to the Stochastic Block Model (SBM) to segregate the Karate Club members into distinct groups, akin to different lung sections, in order to evaluate the likelihood of interactive dynamics or communication pathways between these groups? Think of this in terms of assessing the probabilities of interactions as you might assess the probabilities of airflow in respiratory treatments.",calculations
269,"As a marine archaeologist exploring the depths for historical treasures, imagine you're navigating through a vast network of underwater ruins, represented as an Erdos-Renyi graph with 200 interconnected sites, each with a probability of connection set at 0.1. Now, envision the challenge of uncovering a specific section of this network, akin to isolating a cluster of 50 significant archaeological sites.To aid in this endeavor, you could employ a specialized tool called DepthFirstSearchSampler. This tool operates akin to a randomized depth-first search method, guiding your exploration through the underwater landscape, selecting nodes as it delves deeper into the network. By employing this method, you aim to sample a subgraph containing precisely 50 nodes, mirroring your quest to unearth a collection of historically rich sites amidst the vast expanse of the submerged realm.",calculations
270,"Imagine you're part of a community where each individual (represented by nodes 0 to 3) has relationships with others (depicted as the connections between them). In this community, we've observed interactions that have resulted in a set of connections: individuals 0 and 1 have a bond, as do 0 and 2, 0 and 3, 1 and 2, and finally, 1 and 3. In order to provide personalized support and guidance, it would be beneficial to understand the prominence of each individual within the social structure based on the number of connections they have. Could you help us explore the concept of involvement of these members in the community by determining the degree centrality for each person using the tools provided by NetworkX? This will enable us to better understand who might benefit most from community resources due to their pivotal roles in the network.",calculations
271,"Imagine you are examining an intricate ecological web of plant interactions within a forest, akin to a social network in its complexity and the relationships between species. Within this network, you've categorized the various plants into distinct ecological communities based on their interconnectivity and mutual dependencies, much like distinguishing between different vegetation zones or plant families. Now, suppose you wish to evaluate the strength and appropriateness of this categorization scheme. In botanical terms, it would be like assessing how well these groupings reflect the actual ecological niches. To do this technically, you could use the concept of 'modularity', a measure in network analysis that quantifies the strength of division of a network into modules.For this assessment, you possess a representation of this 'plant network' using networkx, a powerful tool for the analysis of complex networks. Furthermore, you have your community partitioning stored as a dictionary, where each 'plant' (node) is linked to its 'ecological community' (community membership).The challenge before you is to calculate the modularity of this network with the given community partitions using the 'modularity' function provided by graspologic, a library specialized in graph statistics and machine learning. This would be equivalent to determining how closely your defined plant communities reflect the natural divisions within the forest ecosystem. How would you proceed to compute this measure of modularity using graspologic in the context of your ecological plant network study?",calculations
272,"Assuming you have a graph with nodes that each have a 'label' attribute and edges that each have a 'label' attribute, how can you convert the graph to a JSON object comprising a list of nodes and a list of edges, where each list contains the relevant attributes from the graph?",calculations
273,"Imagine you're analyzing a network of dental practices, where each practice refers patients to the next practice in a linear sequence, creating a referral pathway akin to a chain of four clinics. You wish to understand the influence of each dental practice within this referral pathway. Employing a tool akin to an X-ray for network analysis, could you employ NetworkX's eigenvector_centrality_numpy function to discern the relative influence, or centrality, of each practice in this linear referral chain?",calculations
274,"As a network analysis specialist, imagine you are working with a team of researchers who are studying social interactions among the characters in the novel ""Les Miserables."" They have provided you with a GML file named lesmis.gml, which contains the social network graph representing these interactions.The researchers are interested in identifying distinct communities within this social network using the Louvain community detection algorithm. Additionally, they want you to compute the hub dominance for each of these communities to gain insights into the influential characters.As part of your role in this research project, you would need to utilize networkx, a Python library for the analysis of complex networks, to implement the Louvain algorithm and compute hub dominance within the identified communities in the Les Miserables social network.",calculations
275,"As a recreational therapist, you may encounter a scenario where you need to update a histogram of activities to include multiple instances of the same activity. For example, imagine you are working at a rehabilitation center where you organize various recreational activities for individuals with disabilities. You may need to update the histogram to reflect the frequency of certain activities, such as arts and crafts, sports, or music, when individuals participate in them multiple times. This could involve adapting the histogram to accurately represent the repeated engagement of individuals in specific activities, thereby helping to improve their well-being and integration into the community.",calculations
276,"As a network technician, you have been tasked with accurately positioning network nodes for optimal visualization. You have a graph with the following connections: node 0 is connected to nodes 1, 2, 3, and 4. Your task is to use the NetworkX API to compute a star-like layout that places node 0 at the center, creating an organized and visually appealing network graph for analysis.",calculations
277,"As a financial advisor, imagine helping a client with an investment portfolio consisting of 100 different assets. Using advanced tools like the DegreeBasedSampler in the networkx Python library, you want to identify a subset of 17 assets based on their interconnections within the network. Additionally, you aim to compute the degree centrality for each of the selected assets to gain insights into their potential influence within the portfolio. This analysis will aid in optimizing the portfolio's performance and aligning it with the client's financial objectives.",calculations
278,"As an artist creating illustrations for a project, imagine you have a visually connected sequence of elements in your artwork. Each element is linked to its neighbors. For instance, let's say you have a sequence of connected points, (0, 1), (1, 2), (2, 3), representing the connections between various visual elements.Now, to add depth and meaning to your artwork, you decide to assign weights to these connections, with the intention of imparting significance to each transition between elements. For example, you might want to assign weights of 1.0, 2.0, and 3.0 to the connections (0, 1), (1, 2), and (2, 3) respectively.In this scenario, you might use the `set_attribute_values` method from the igraph's `EdgeSeq` API to indicate the weights of these connections. After updating the attributes, you would be able to visually represent the significance of each transition in your artwork, allowing the viewer to appreciate the depth and intention behind the connections in your illustration.",calculations
279,"As a chef plans menus, cooks, and oversees the operations of a kitchen in a restaurant or hotel, you may encounter the need to create a special dish that requires precise measurements and unique ingredients. In this case, you might be interested in using a specialized culinary tool, such as a molecular gastronomy kit, to transform familiar ingredients into a whole new culinary experience. Similarly, you may need to use the SocioDim model from the KDD ‘09 paper 'Relational Learning via Latent Social Dimensions' to embed a karate club graph into a 128-dimensional space, allowing for a new perspective on the social interactions within the community.",calculations
280,"As a network analyst, you may be asked to identify clusters within a network graph, like the topology of a computer network, in order to better understand its structure. In a practical scenario, imagine that you are working for a large technology company that aims to analyze the connectivity and relationships within their data center network to optimize performance and minimize downtime. You are tasked with applying the IPCA community detection algorithm in the cdlib library to identify clusters within the network graph that represents their data center topology. Once the clusters are identified, you may need to convert the resulting communities into a JSON format and provide a way to visualize or further analyze the cluster information.",calculations
281,"Imagine you're developing a new strategy to enhance the engagement on your social media platform's network, with various pages (like 'A', 'B', 'C') interacting through directed efforts (akin to follows or shares) that carry certain weights, representing the strength or impact of these interactions (3, 2, 1, and 1, respectively, for the edges 'A' to 'B', 'B' to 'C', 'C' to 'A', and 'C' to 'B'). To optimize the flow of content and ensure that users are drawn towards the most influential pages—akin to a PageRank algorithm—you're keen on calculating a directed Laplacian matrix for a random walk with teleportation, which reflects the likelihood of users navigating through your platform organically versus being directed to a page. How might you employ NetworkX to derive this matrix, and thus effectively strategize where to inject promotional content or analyze page influence?",calculations
282,"As a certified public accountant (CPA), we're often faced with extensive data matrices that need optimizing in order to enhance business operations. Imagine a situation where you have a numpy array, for instance, one like this:np.array([   [0, 1, 1],   [1, 0, 0],   [1, 0, 0]])In the realm of graph theory, and specifically within package such as graspologic that we use so often to manipulate and analyze our accountancy data, how could we, in this scenario, take advantage of the ""augment_diagonal"" function to augment the diagonal of our array?",calculations
