id,question,problem_type
1,"Imagine you've come across a detailed .dot file that's akin to a treasure map, unveiling the intricate relationships and connections within a collection of prized jewels. This map is the ""JewelRelations.dot,"" and it's teeming with data about the interactions and points of contact between various pieces in a vast collection. In order to assess and perhaps even enhance the value of this collection, you seek to transfer the information from this dot file into a more malleable structure. How would you elegantly transpose the data from ""JewelRelations.dot"" into a MultiGraph or Graph object within the sophisticated toolbox of NetworkX? This strategic move will enable you to manipulate and explore the connections with the finesse befitting a Jewelry Appraiser at the peak of their craft.",calculations
2,"Imagine you're tending to a collection of greenhouses, where pathways between certain greenhouses represent your edges: [(0,1), (1,2), (2,3), (5,6), (3,4)]. Each greenhouse is represented by a number, and a direct path exists only between connected numbers. To optimize travel time and resources, you want to figure out whether it's necessary to visit each greenhouse individually or if some are already connected via these direct pathways. How would you determine the total number of separate groups, or ""connected components,"" of greenhouses that aren't linked by any of the existing pathways?",calculations
3,"Imagine that we have a community network, represented by a map of relationships and connections between different key points or hubs. This web of connections includes pathways of support, each with a different level of strength symbolized by differing weights. The connections are bidirectional, denoting a reciprocal flow of aid.The network's key relationships are described as follows: hubs 0 and 1 share a connection with a strength of 2, hubs 0 and 2 with a strength of 1, hubs 1 and 2 have a stronger bond at 3, hubs 1 and 3 are at a strength of 4, and finally, hubs 2 and 3 share a supportive link with a weight of 2.I would like to extend our resources and understand every possible configuration of these connections that would keep the community network integrated, while fostering a supportive environment that remains as unburdened as possible. To achieve this, we need to consider every unique pathwayor in our technical language, every ""spanning tree""that connects all the hubs without any loops, organized from the least to the most supportive strength required for upkeep.Additionally, to keep this information organized and accessible for future review, consultation, or collaborative planning, could you transcribe our community map into a systematic file using the Pajek software format?In terms of practical next steps using NetworkXour toolkit for investigating these interconnected pathwaysthis would involve creating the network from the provided relationships, finding all the spanning tree configurations, and saving the data into a file formatted for Pajek for ready reference.",calculations
4,"To better track and analyze the emotional changes within our community, consider using the concept of a ""Running Mean."" Imagine we have a symbolic ""Sentiment Meter,"" and we decide to register a value of 20 in it ten times, representing consistent positive input.After each entry, we will calculate the current average sentiment (the mean) and the range of sentiment variation (the standard deviation) to understand the collective emotional changes.Can you demonstrate how to use the RunningMean.add function in the igraph library to add 20 ten times and get the current mean and standard deviation? Please ensure to print the result.```pythonprint(f""Mean degree: {mean}, Standard deviation: {std_dev}"")```",calculations
5,"As a Pollution Control Engineer working on optimizing the route for a team to investigate various points of interest for environmental assessment, you've mapped out several locations with potential pollution factors and their respective inter-connectivity impact values. Your graph consists of locations A, B, C, D, E, and F, each representing a different site of interest. The impact values between the sites are represented as follows: the route from 'A' to 'B' has an impact of 0.6, 'A' to 'C' has 0.2, ‘C’ to 'D' is 0.1, ‘C’ to 'E' is 0.7, ‘C’ to 'F' is 0.9, and ‘A’ to 'D' has an impact of 0.3.If we consider the impact values akin to distances, could you determine the route with the least environmental consequence starting from Location A and reaching Location D? The methodology you’ll use is akin to a Dijkstra's algorithm for identifying the shortest path, only in this case, ""shortest"" equates to ""least environmental impact"". This optimization could significantly contribute to reducing our team's environmental footprint while they conduct the necessary field assessments.",calculations
6,"Imagine you're a Rehabilitation Counselor working with an individual who enjoys solving puzzles as a form of cognitive therapy. To create an engaging problem for them, you have developed a puzzle representing a network of tasks and dependencies, depicted by a series of connections, or 'edges', between 'nodes'. The puzzle is drawn out as a graph with specific relationships: (1 connects to 2), (2 connects to 3), (3 connects to 4), (4 connects back to 1), (1 also connects to 3), and (2 connects to 4). Your goal is to guide them through an exercise that involves finding an efficient way to organize these tasks, allowing a balanced distribution without overwhelming any single point in the network. This is akin to calculating the 'treewidth' of the graph, which serves to measure how tree-like the network is. Specifically, you seek to use a method known as the 'Minimum Fill-in heuristic,' which helps in obtaining the most streamlined arrangement, known as a 'tree decomposition,' without actually altering the puzzle's connections. The challenge for your client is not only to understand the complexity of the network but also to apply a strategic approach to simplify the relationships between the tasks. By presenting the treewidth calculation as a puzzle objective, you aim to stimulate your client's problem-solving skills and aid their cognitive rehabilitation process. How would you go about determining the treewidth and achieving the tree decomposition using the 'Minimum Fill-in heuristic' for this graph?",calculations
7,"As an IT consultant, you have been tasked with optimizing the network infrastructure of a large logistics company. The company's distribution centers are connected via a complex network of routes, and they want to determine the maximum flow of goods that can be transferred between two specific locations. Additionally, they need to identify the critical routes that, if interrupted, would impact the flow of goods from the source to the target.To achieve this, you need to leverage the 'maxflow' function in igraph to calculate the maximum flow value, determine the flow on each edge, and identify the edges that contribute to the minimum cut, representing the critical routes that need to be safeguarded.Your expertise in systems integration and software development will be essential in utilizing the 'maxflow' function effectively to provide the logistics company with valuable insights into their network's capacity and vulnerability.",calculations
8,"Imagine that you are a landscape designer, and you're planning a new park with a variety of pathways and meeting points, represented by a network of trails (edges) and rest areas (nodes). Each rest area has a specific number of pathways leading to other spots (independent edges), and some areas are designed to connect three trails, creating a triangular junction (triangle degree).You've been given a layout plan for the park, where the rest areas are defined by their connectivity: [(1,0), (1,0), (1,0), (2,0), (1,0), (2,1), (0,1), (0,1)]. Each pair relates to a rest area, with the first number detailing how many individual trails branch out, and the second number indicating if it's part of a triangular junction or not.Your task is to draft up a random but plausible design of this network, using the given connectivity blueprint. However, as in the refined design process, you need to ensure that all the pathways are distinct and the rest area connections are straightforward, meaning no double pathways (parallel edges) and no trails looping back to the same area (self-loops).Once you've refined the design, please list the rest areas (nodes) and pathways (trails) that constitute the simplified network of the park. This will give us the clear layout needed to move forward with developing the park.",calculations
9,"As a Brewmaster overseeing the brewing process and ensuring beer quality, you might encounter situations where you need to monitor the consistency of certain ingredients over time. For instance, let's say you're working on perfecting a new IPA recipe that requires precise measurements of hop concentrations. You have a sequence of hop concentration values [10, 20, 30], and you're interested in calculating the running mean to track any fluctuations. In order to do this efficiently, you're considering using the RunningMean library, which offers functions tailored for such calculations in real-time. How would you utilize the RunningMean library to compute the running mean of hop concentrations and represent it in its complex form?",calculations
10,"Imagine we're analyzing the workflow within a company's internal network, where each department's communication is represented as a connection in a data flow diagram. The connections we have logged between departments are as follows: Communication originates from the main server (0), branching out to the IT support (1) and the Research department (2). IT support further liaises with the Operations department (3), and so does the Research department. Finally, Operations has a direct line to the Marketing department (4).To optimize our network efficiency and determine potential bottlenecks or key transfer points, we need to calculate the load centrality for each department—essentially pinpointing the departments that play a critical role in the circulation of information. The load centrality metric will tell us the proportion of the most direct communication paths that pass through each department in our network diagram.Your task as a Data Analyst is to integrate the given connections into our company's network model using the NetworkX library and compute the load centrality for each department node. You'll then present the centrality values, which will offer actionable insights into how information flows through our business and where critical communication hubs are situated. This analysis will be instrumental in enhancing the robustness of our communication network and improving overall operational efficiency.",calculations
11,"As an IT consultant, a client has a network of 100 nodes representing employees and wants to analyze the connections between them. They would like to use the MNMF model, detailed in the AAAI ‘17 paper 'Community Preserving Network Embedding,' to obtain embeddings for the nodes, identify cluster centers, and determine the memberships of each node within the clusters. The client is interested in leveraging this analysis to better understand communication patterns and potential subgroups within the organization.",calculations
12,"Imagine that we are orchestrating a networking event where various professionals are represented as nodes within a social graph, connected by their collaborations, akin to edges in the graph. For the sake of fostering connections between attendees, we've identified clusters of professionals who frequently collaborate, akin to communities within the graph. Within our list of attendees, we have four individuals: A, B, C, and D, with the following collaboration history: A has collaborated with both B and C, B has collaborated with D, and C has also worked with D.We have categorized A and B into one collaborative community—let's call it ""Community Innovation""—and C is designated to ""Community Exploration"". D, however, bridges the gap between both, being a part of ""Community Innovation"".In preparation for the event, we're curious about the potential for resource sharing between attendees A and D, who are both from ""Community Innovation"". To gauge this, we hope to calculate the Resource Allocation Index between A and D, while taking into account their shared community.Could you assist us in utilizing the 'ra_index_soundarajan_hopcroft' function within our event planning software, which is essentially NetworkX under the hood, to gain insight into the possible collaboration intensity between A and D? This would require considering the graph structure and community information [A & B (Community 0), C (Community 1), D (Community 0)] to provide a metric that could inform us on how we might want to structure their interactions at our event for maximum synergy.",calculations
13,"As a Remote Sensing Scientist, you have been tasked with analyzing satellite imagery to monitor and interpret the environmental data of a particular region. The data includes a directed graph representing the relationships between different locations, with edges [(1, 3), (3, 4), (2, 4), (4, 5)]. Utilizing tools such as NetworkX, you are required to find the shortest path from a specific location (node 1) to another (node 5) within this graph to aid in planning and decision-making related to environmental monitoring and management.",calculations
14,"Imagine you're overseeing a network of agricultural fields connected by pathways, represented by a graph. Each pathway connects two fields, and the connections are as follows: Field 1 to Field 2, Field 2 to Field 3, Field 3 to Field 4, Field 4 to Field 5, Field 1 to Field 5, and Field 2 to Field 4. Your task is to establish a system of partnerships where each field is paired with another field through a direct pathway. The goal is to minimize the number of partnerships while ensuring that every field is either in a partnership or directly connected to a field that is. Could you devise a plan that identifies the fewest number of necessary field partnerships to achieve this connectivity within the network?To clarify, this scenario is asking for the minimum maximal matching of the graph, with the edge set detailed above. Youre required to present the specific pairings (matchings) between fields, ensuring each field is involved in or adjacent to at least one partnership. If you could outline these pairings, that would assist in optimizing the network management and ensuring our agricultural resources are effectively connected.",calculations
15,"Imagine you're monitoring the growth patterns of a series of interconnected gardens at a large horticultural research facility. Each garden has pathways to others, with the pathways marked by the time (in minutes) it takes to walk from one garden to another. Some pathways are quick and direct, while others are more winding and time-consuming. The layout of the pathways can be described as a directed network, with each pathway having a sign indicating the walking time required, which can sometimes be negative due to downhill slopes that make the walk faster. Yet, the overall system is well-maintained, ensuring there are no loops where you could end up walking endlessly.The walking times between gardens are as follows: from Garden 0 to 1 takes 5 minutes, from Garden 1 to 2 takes 2 minutes, from Garden 2 to 3 takes -3 minutes (as it's downhill), from Garden 1 to 3 takes 10 minutes, and from Garden 3 back to 2 takes 8 minutes due to an uphill path.You've been asked to create an efficient visiting schedule, with the goal of determining the quickest routes between all pairs of gardens, so that no valuable time is wasted by your team of horticulturists. This puzzle is akin to looking for the all-pairs shortest paths within this network of gardens. Can you calculate these shortest walking times for every possible pair of gardens, using a method akin to Floyd's algorithm, and neatly arrange the times in a matrix format? This matrix will serve as a valuable resource for planning the daily activities and routes of the horticulturists effectively, ensuring they can traverse the gardens swiftly and spend the maximum possible time attending to the plants. The resulting matrix must be such that the entry at row i, column j shows the least number of minutes required to get from Garden i to Garden j. Please craft a schedule that reflects these times.",calculations
16,"As a forensic accountant, imagine you are piecing together a complex network of financial transactions that may unravel a case you're working on. Your analytical approach requires you to simulate various transaction patterns to understand potential fraudulent structures. Think of each node as an entity involved in the financial network, and the edges represent the transactions between them.You need to construct a simplified model of this network for your initial analysis. This model should be a random tree structure consisting of 5 entities, which will represent the possible flow of transactions within a segment of the network you're investigating. To ensure consistency in your simulation analyses, you'll set a fixed seed of 42 for the random number generator, which guarantees the reproducibility of the tree structure in your case study.Under these conditions, how would you proceed to create such a model using NetworkX? I'm specifically interested in the layout of this simulated network, so what would the structure look like when we impose the condition of using seed 42 in our replication scenario?",calculations
17,"Imagine you are studying a network representing the transmission of skin diseases across different points on the skin. Each node represents a specific point on the skin, and each edge represents a direct transmission path between these points. To better understand the transmission patterns of skin diseases, you have drawn a network diagram marking these points and their interconnections.In this network, each node represents a specific point on the skin, for example:Node 0: ForeheadNode 1: Left CheekNode 2: Right CheekNode 3: ChinEdges represent the possible transmission paths of the skin disease between these points. For example:Edge (0, 1): The disease can spread from the forehead to the left cheekEdge (1, 2): The disease can spread from the left cheek to the right cheekEdge (2, 3): The disease can spread from the right cheek to the chinEdge (3, 0): The disease can spread from the chin back to the foreheadEdge (0, 2): The disease can spread directly from the forehead to the right cheekTo identify potential transmission pathways of skin diseases, we need to analyze the basic cycles in the network. These cycles represent the possible recurring transmission patterns of the disease, which can help us formulate more effective treatment strategies. Using a tool similar to the minimum_cycle_basis function, we can find the simplest, non-overlapping, and independent cycles in the network. These cycles are the most fundamental transmission paths.Let's envision how you could present the results of this question:```pythonprint(""Minimum Cycle Basis of the Skin Condition Network:"")for cycle in mcb:    print(cycle)```",calculations
18,"As an ecotourism guide leading environmentally responsible tours, you may encounter a scenario where you need to assess the ecological impact of a certain route or trail. You might have collected data on the connections among different locations, represented as edges in a graph. Using the independence_number function in the igraph library, you can determine the maximum number of locations that can be visited without any direct connections between them, helping to plan routes that minimize disruption to the natural environment.",calculations
19,"As a Marketing Manager, you are overseeing four major cities 'A', 'B', 'C', and 'D' for a promotional roadshow. You need to start the roadshow from city 'D', travel through each city once to promote your product and finally return back to city 'D'. The cost of traveling between each pair of cities, in both directions, varies and has been detailed out for you, each named city representing a node. Considering promotional activities, travel costs, and city-to-city distance as factors influencing the weights of the edges in this directed graph, your goal is to lessen the total cost by identifying the most cost-efficient route. The question is about figuring out the best order to visit these cities by minimizing the total cost of the roadshow, given it begins and ends at city 'D'.Could you seek an approximate solution to this traveling Marketing Manager problem where the itinerary starts and ends at city 'D', passes through every other city once with the overall cost cut down? Please keep in mind, this must be based on the data provided in the ""city_travel.gml"" file which includes details about costs between all cities.",calculations
20,"As a Philanthropy Advisor, suppose you're working on a social impact initiative that utilizes the well-studied karate club graph to unveil the underlying societal interactions. For further data analysis, you're attempting to create an adjacency spectral embedding of this graph using the `adjacency_spectral_embedding` function from the graspologic library. How might you go about generating this embedding and displaying the output as a dictionary for easy comprehension?",calculations
21,"As a histologist, imagine we have a chart representing a complex organic structure, akin to our tissue samples, with different cells represented as points interconnected in a delicate hierarchy. In our system, we have cells labeled 0 through 5, which are intricately linked, mimicking a directed flow similar to blood or intercellular signaling paths. The connections are as follows: cell 0 signals to cells 1 and 3, cell 1 to cell 2, cell 3 to cell 4, while cells 2 and 4 both send signals converging on cell 5.In the grand scheme of this biological architecture, we are tasked with uncovering the closest mutual origin cell—the lowest common predecessor—for each and every pair of these cells, given the unidirectional signaling paths between them. How might we systematically identify the shared starting cell for all unique cellular pairings within this network, assuming such a point of convergence exists within the non-cyclic pathways etched into the fabric of our tissue chart? This identification would prove invaluable in understanding the routes of communication and influence within the sample, providing insights into which cells might serve as control points for certain cellular functions or disease proliferation.The underlying framework of this system, should you need to refer to it in a digital format, could be summarized in a GML file named ""tissue_structure.gml"", encoding the intricate web of cellular communication within our sample.",calculations
22,"As an ethical hacker, let's say you are performing a security assessment for a company's network using the NetworkX library. You have a directed graph representing the network with 5 vertices and specific edges. You need to reverse the direction of the edge from vertex 1 to vertex 2 using the `.reverse_edges` method in NetworkX.",calculations
23,"As a receptionist, you might encounter a situation where a visitor arrives with a large stack of papers containing redundant information and multiple copies of the same document. Using a tool like 'simplify' in igraph can help streamline and declutter the information, much like removing duplicated phone numbers from a contact list.",calculations
24,"Imagine you're strategizing on reshaping the team dynamic within a department, and you've mapped out a linear workflow that connects four key roles: Employee-0, Employee-1, Employee-2, and Employee-3. You've decided to merge the responsibilities of Employee-1 and Employee-3 in an effort to streamline processes, without creating redundant tasks (akin to self-loops in the workflow). Could you re-envision what the team structure (akin to nodes) and the workflow connectivity (akin to edges) would look like post-restructuring, ensuring that the amalgamation of duties does not lead to overlapping responsibilities? Please craft a summary that encapsulates the new team framework, bearing in mind that the original sequential flow goes from Employee-0 through Employee-3.",calculations
25,"As a seasoned silviculturist overseeing the sustainable management of a forest, imagine you're conceptualizing the diverse network of trails that connect various checkpoints (represented as trees) within your timberlands. You've identified a selection of trails that could potentially form an interconnected loop-free path resembling the branching structure of a tree, which would ensure a single, accessible way for rangers to navigate and manage the area without redundant routes.Specifically, the trails you're considering form the connections between the checkpoints as follows: Trail from Tree 1 to Tree 2, Tree 1 to Tree 3, Tree 2 to Tree 3, Tree 3 to Tree 4, Tree 4 to Tree 5, Tree 5 to Tree 6, and finally, Tree 6 links back to Tree 1.Would you be able to evaluate if the assemblage of these trails indeed forms a structure without cycles, akin to a real tree in your forest, using the principles of graph theory? If it does, this would definitively be a single connected network without any circular trails, thereby optimizing our task of forest managing and making patrols more effective.Remember, the goal is to apply your ecological expertise with the theoretical model to ensure the network represents a tree structure, crucial for efficient woodland stewardship.",calculations
