id,question,problem_type
502,"Imagine you're in your orthodontics practice, aligning the flow of patient treatments, which, much like the teeth in our dental care, must be managed to ensure efficiency and effectiveness. Your clinic's streamlining process resembles a sophisticated directed acyclic graph—clear in direction but complex in connections—with various stages of treatment represented as nodes and the transitions between them as edges. We can denote the current workflow with these transitions: [(1, 2), (1, 3), (2, 3), (3, 4), (4, 5)].Now, to optimize this flow and remove any unnecessary steps—akin to performing an occlusal adjustment to ensure direct force paths—you seek to compute the transitive reduction of this graph. It's a procedure that will simplify the treatment stages while maintaining the essential sequence of operations. However, it’s crucial that each node (representing a stage, such as initial consultation, fitting for braces, adjustments, etc.) and edge (the transition between these stages) retains their specific details—such as the type of braces or the specific treatment information - in this 'reduced' model.How can one use NetworkX to perform this operation on such a graph, ensuring that the specific characteristics and information of each treatment stage and transition are meticulously conserved in the simplified workflow?",calculations
503,"As a photo retoucher working on a project involving network analysis for a photography exhibition, you're tasked with enhancing the visualization of a network representing connections between 100 influential photographers. Your goal is to create visually appealing node embeddings using a specialized algorithm called GraphWave. You'll be using the GraphWave model, based on the techniques outlined in the KDD ‘18 paper “Learning Structural Node Embeddings Via Diffusion Wavelets”. To do this, you'll work with a dataset representing the connections between these photographers, where each connection has a probability of 0.05 of being present. Your specific parameters for generating these embeddings include:- Sample number: 200- Step size: 0.1- Heat coefficient: 1.0- Chebyshev polynomial approximation order: 100- Approximate wavelet calculation method: Switch to approximation for vertex cardinalities beyond 1000- Random seed value: 42To implement this, you'll utilize the NetworkX library, incorporating its capabilities to apply the GraphWave algorithm to the network dataset. This will allow you to generate enhanced visual representations of the photographers' connections, providing deeper insights into their relationships and influences within the photography community.",calculations
504,"That's a fascinating query, reminding me of a dentist's typical workday dealing with diagnosing and treating various oral health conditions. A dentist uses different tools depending on the condition to be addressed. Imagine a scenario where a dentist has different dental structures (like a graph from ""littleballoffur1.sparse6"") and wants to focus on a specific part of a dental structure (like sampling a subgraph). An interesting aspect would be the strength or connectivity among various teeth (as computing node connectivity among all pairs of nodes).Considering a dental structure graph read from ""littleballoffur1"" as an example, is it possible to use the BreadthFirstSearchSampler from littleballoffur to sample a subsection of the structure consisting of 10 teeth and then determine all possible connections among the sampled teeth?",calculations
505,"Imagine you're working on a web development project where you're tasked with visualizing a network of connections between different entities represented as small graphs. You have two graphical datasets. The first graph dataset contains relationships defined by pairings (0, 1), (1, 2), (0, 2), and the second one includes the connections (0, 1), (1, 2), (2, 0).Your challenge is to employ the `count_isomorphisms_vf2` function from the igraph library to determine how many structurally identical mappings exist between these two datasets, essentially figuring out in how many ways these networks can be considered the same based on their structure.Following up, you need to simulate the growth of the network in the first graph by adding a new node and establishing a connection (an edge) to an existing node. After this expansion of the graph, you're expected to utilize the `closeness` function of igraph to calculate the closeness centrality measures for each node, which will help you understand the average distance from each vertex to all other vertices in the graph and thus gauge the efficiency of information or resource transfer within the network. Integrating this data effectively into a user-friendly web interface will enhance the analytical capabilities of your application.",calculations
506,"As an immigration lawyer representing clients on immigration laws, visas, and citizenship matters, imagine you are helping a client navigate through the process of obtaining a specific type of visa to work in the United States. Your client is a skilled professional in the field of network analysis and needs to understand the process of sampling a subgraph from a given networkx erdos_renyi_graph using the ForestFireSampler. The client has provided the following details about the graph: n=500, p=0.15. They need to sample a subgraph containing 150 nodes with a burning probability of 0.35 using the ForestFireSampler and perform operations on the sampled graph. You are tasked with explaining the steps involved in utilizing the ForestFireSampler to sample the subgraph and perform the required operations.",calculations
507,"Imagine you're a fitness instructor, and each of your exercise routines is represented by a different geometric formation. Your cycle graph with 4 nodes is like a perfect circuit routine involving 4 exercise stations, while your wheel graph with 5 nodes resembles a more complex routine with an added core workout at the center connected to each station. Now, you're looking to transform your 4-station routine into the 5-station one with minimal adjustments. To achieve this, you're considering the 'optimal_edit_paths' function in NetworkX, a tool that can help you find the most efficient way to transition from one routine to the other. The question here is, how might you use this function to identify all the minimum-cost edit paths for turning your 4-station cycle into a 5-station wheel? Furthermore, you are interested in knowing the cost of making this transformation most effectively. How would the outcome influence your approach to enhancing and evolving your fitness programs?",calculations
508,"As a workplace ergonomist, you may encounter a scenario where a team has just implemented a new collaboration platform. The platform features a network of 100 colleagues, and the team is interested in analyzing the relationships between them. Using the G(N,p) model with a probability of edge creation set to 0.5, you can leverage the NetMF model to derive node embeddings. This will provide valuable insights into the interconnectivity of colleagues within the network, ultimately enhancing collaboration and optimizing the workspace for improved efficiency and safety.",calculations
509,"Imagine you have a community with two types of nodes: **residents** and **facilities**. The usage relationships in the community are as follows:- Resident 0 can use facilities 7 and 8- Resident 1 can use facilities 7 and 9- Resident 2 can use facilities 8 and 10- Resident 3 can use facilities 9 and 11- Resident 4 can use facilities 10 and 11- Resident 5 can use facilities 7 and 10- Resident 6 can use facilities 8 and 9Each node's type is specified as follows, with False representing residents and True representing facilities:```pythontypes = [False, False, False, False, False, False, False, True, True, True, True, True]```Given the edge set and node types, can you use the `get_biadjacency` function in the `igraph` library to obtain the biadjacency matrix of this bipartite graph?Note: You need to print the biadjacency matrix.",calculations
510,"As a park ranger overseeing the health of various interconnected ecosystems within our national park, imagine each habitat zone as a point of interest, with paths between them representing ecological connections. Currently, we have the following zones connected as such: Zone 1 to Zone 2, Zone 1 to Zone 3, Zone 2 to Zone 4, Zone 2 to Zone 5, Zone 3 to Zone 5, and Zone 4 to Zone 5. To effectively manage our conservation efforts, we require a deeper understanding of the influence each zone has on the interconnected network.The tool we're interested in applying is the subgraph centrality metric, which can offer insights into the significance of each habitat zone within our ecological network. Could you assist in utilizing the `subgraph_centrality_exp` function to gauge the subgraph centrality for each zone? This information is crucial as it will allow us to allocate resources and attention to zones that are central to the health of the park's ecosystem network. For this, it would be beneficial to have a list showcasing the centrality of each zone. Here are the connections between the habitat zones for your reference:Edge Set: [(1, 2), (1, 3), (2, 4), (2, 5), (3, 5), (4, 5)] Please proceed to analyze this data while maintaining the integrity of our natural resources.",calculations
511,"Imagine you're on set, and you've just wrapped up filming an insightful documentary. During the post-production process, you decide to catalog all the footage using a digital inventory system. Each clip's metadata is represented as a string that looks like a Python dictionary, for example, ""{'name': 'Alice', 'age': 30}"". Now, to properly organize and search through your database, you need to convert these string representations into actual, usable Python dictionary objects. How would you go about transforming this string type metadata into a real dictionary format for your inventory system? Keep in mind, there's no GML file to consider—just the data given in the string representation.",calculations
512,"As an architect tasked with conceptualizing a new complex structure, suppose you've been inspired by the intricate patterns within graphs and trees to potentially model your design—visualizing nodes as functional spaces and edges as connectivity pathways. Envision crafting a design based on a hypothetical 'cograph,' a specific type of graph notable for its lack of induced paths of length three, which translates well into a balanced, efficient layout.Could you contemplate designing a sketch that accommodates a cograph with a compounded growth pattern, specifically one that matures exponentially to accommodate 2^3, meaning 8, distinct spaces? This cograph would offer us a foundation for understanding how these spaces might interrelate. If your design could gracefully unfold this configuration, detailing both the distinct spatial zones (analogous to nodes in our cograph) and the direct connections between these areas (similar to edges), it would provide a clear blueprint of how the layout facilitates interaction without the complexity of cumbersome pathways.For clarity in reference and modification, let's say you've saved this cograph structure as a GML file named 'ComplexDesign.gml'. How would this file illustrate the nodes representing functional spaces and the edges denoting their straightforward connections within your architectural scheme?",calculations
513,"Imagine you're piecing together a case and you have a network chart of suspects and contacts with limited communication bandwidth. The chart is a valuable piece of evidence detailing who connects to whom and the maximum amount of information they can share. You've identified the primary suspect, labeled as 'x,' and a key target of the investigation, 'y.' The connections between individual suspects and contacts are represented as a series of capacity-limited communication channels with the following details:- The network diagram is recorded in a case file titled ""suspect_network.gml.""- In the file, the connections are listed as: [('x', 'a', 3.0), ('x', 'b', 1.0), ('a', 'c', 3.0), ('b', 'c', 5.0), ('b', 'd', 4.0), ('d', 'e', 2.0), ('c', 'y', 2.0), ('e', 'y', 3.0)]. Here, each tuple denotes a directed link from one suspect to another, with the third number indicating the maximum amount of information (capacity) that can be transmitted through that channel.In the context of your investigation, it's crucial to determine the weakest link in the network, that is, finding the point where information flow is most restricted between the primary suspect 'x' and the target 'y.' This will help you strategize how to cut off communication most effectively. Could you calculate the smallest total capacity that would need to be disrupted to sever 'x' from 'y' in this network? This corresponds to identifying the value of the minimum cut within this communication network.",calculations
514,"Imagine you're analyzing the remnants of an ancient society's communication network, trying to understand the directional pathways through which information might have flowed from one settlement to another. You've mapped out what you believe to be a representation of this network based on the artifacts and ruins discovered, which suggests a series of connections resembling a graph with the following edge set: [(1, 2), (2, 3), (3, 4)].Now, to determine if this network could represent a hierarchical structure of information dissemination without any feedback loopsakin to a tree where knowledge flows unidirectionally without returning to its sourcecan you ascertain whether this reconstructed network is indeed a Directed Acyclic Graph (DAG)? Please discern and furnish a simple True or False to represent the presence or absence of cyclical pathways within this hypothetical communication network.",True/False
515,"Imagine you're choreographing a complex dance routine that requires a seamless flow of movements, much like the interconnected steps in a network. In our dance studio of connectivity, think of each dancer as a node in a network, with each pair's connection represented by their potential to perform a flawless pas de deux.So, in our dance network, we have a quartet of dancers (nodes) who interact as follows: dancer 1 with dancer 2, dancer 1 with dancer 3, dancer 2 with dancer 4, and dancer 3 with dancer 4. These pairings are our edge set: [(1, 2), (1, 3), (2, 4), (3, 4)].Now, let's zoom in on dancers 1 and 4. I'd like you to think about how efficiently these two can interact, despite not being direct partners. It's a calculation that measures how directly the energy and communication (or in your case, the dance moves) flow between them. If you could, please calculate the efficiency of the connection between dancer 1 and dancer 4 to ensure the gracefulness of our performance.For an encore, you would have the graph data you need: a set of connections between the dancers represented as edges. Just let that final efficiency number take a bow.",calculations
516,"As a Life Cycle Assessment Specialist, imagine you are tasked with evaluating the environmental impacts of a manufacturing process. You have a specific point of interest within the process with coordinates (3, 4). You are asked to utilize the Point.Point.__mul__ method to scale the coordinates of this point by a factor of 5. This will help you understand the effects of changes in scale on the environmental impact of the process.",calculations
517,"As a salesperson working in a retail store, you are tasked with organizing a set of products in a way that reflects the underlying connections between them. Imagine each product as a vertex in a graph, and the relationships between them as edges. Now, your task is to use a tool like igraph's dfsiter function to systematically explore and categorize these products in a way that mirrors a Depth First Search order. How would you go about using igraph's dfsiter function to achieve this and print all the products in the desired order?",calculations
518,"As a Disaster Recovery Specialist, imagine we're conducting a resilience analysis of our network infrastructure using a graph model that's been saved in a GML file named 'graph41.gml'. Our objective is to evaluate the robustness of our network by examining the connectivity distribution across the nodes. For this, we require a statistical measure, specifically the mean degree of the nodes, as well as the degree variance which is crucial for assessing the potential impact of node failures on the overall network.Can you demonstrate the process using the igraph library's RunningMean.add_many function in Python, to incorporate the degree data of all vertices from our 'graph41.gml' graph into a RunningMean instance? Once you've compiled that information, we'll need a precise output displaying both the average degree and the standard deviation in the following format:```pythonprint(f""Mean degree: {mean}, Standard deviation: {std_dev}"")```This will enable us to quantify the degree distribution and integrate it into our disaster recovery plan.",calculations
519,"Imagine you are advising a client who is keen on optimizing their investment portfolio, which can be visualized as a network of financial instruments interconnected through various dependencies. The relationships in this network are represented as follows: the bonds between Investment A and Investment B, Investment B and Investment C, Investment C and Investment D, Investment D and Investment A, plus additional linkages from Investment A to Investment C, and from Investment B to Investment D.Your client is interested in a strategic analysis that involves calculating the 'treewidth' of this investment network, which is akin to assessing the complexity within the network of investments. In financial terms, you might compare it to evaluating the diversification of a portfolio. The method your client has asked you to use is akin to the 'Minimum Degree heuristic', a technique to minimize risk by analyzing the minimal points of connection within a portfolio.Additionally, the client is requesting a 'tree decomposition' of the network, a structure that would dismantle the network into a tree-like hierarchy, revealing the dependencies and the interconnections between these investments in a more digestible format.This practical application will help you provide a clearer insight into the portfolio's structure and suggest potential strategies for rebalancing or simplifying the investment network. Therefore, we are not just looking at the numbers but analyzing the underlying structure of their financial landscape. How would you go about processing this request using the given data and methodology?",calculations
520,"Imagine you are a consultant for a cybersecurity company, tasked with analyzing the flow of sensitive information between internal servers to identify potential vulnerabilities to identity theft. These servers are used to store and process employees' personal information, financial data, and customer information. The connections between the servers represent the direction of information transfer, as follows:Server A (0): The main server of the company, storing basic employee information.Server B (1): Responsible for processing employees' financial data.Server C (2): Used to store and process customer information.Server D (3): Used for analyzing and processing big data to generate reports.Server E (4): Used for data backup and disaster recovery.The paths of information flow between the servers are as follows:Information is transferred from Server A to Server B (0 -> 1).Server B sends financial data to Server C (1 -> 2).There is a bidirectional data exchange between Server C and Server B (2 -> 1).Server C sends customer information to Server D for analysis (2 -> 3).Server D transfers analysis results to Server E for backup (3 -> 4).Server E returns data to Server C for further processing (4 -> 2).To analyze the sequence of information transfer and potential vulnerabilities between these servers, you need to perform a depth-first search and calculate the network's reciprocity, which measures the bidirectionality of information exchange.",calculations
521,"As a costume historian, you have access to a unique collection of vintage clothing and costumes from various historical periods. You are interested in analyzing the collaborative relationships between different fashion designers and their influences on each other's work. Leveraging network analysis, you want to apply the Louvain method from the cdlib library to detect communities within this network of designer collaborations. Additionally, you aim to calculate the average distance within the detected communities to gain insight into the strength of connections between designers and their collaborations.",calculations
522,"As a blockchain developer, you're tasked with analyzing the flow of digital assets within a blockchain network. To do this, you'll need to model the network as a directed graph, using the provided transaction data. The edges, detailed in `transaction_data.json`, represent the likelihood of assets moving between nodes (e.g., ""A"" to ""B"" has a 0.5 transaction probability). This graph mirrors the ledger's architecture with nodes symbolizing participants and edges signifying transaction paths and their associated probabilities.In this network, certain nodes are characterized by custom personalization metrics to model their impact on the transaction flow, such as 'A' having a base transaction preference of 0.1. These personalization values are stored in `node_preferences.json`. Additionally, some nodes may act as sinks, which can affect the overall asset flow model, as denoted by the 'D' node with a dangling value of 0.1; this is captured in `dangling_nodes.json`.Your objective is to construct the Google matrix as a means to apply the PageRank algorithm to this blockchain network. This will help in understanding the importance of each participant within the network. For network construction and PageRank computations, utilize the NetworkX library, which is apt for such graph-theoretic problems.Can you reorganize the edge set, personalization values, and the dangling node dictionary into the context of blockchain transaction flows, and compute the Google matrix using NetworkX to evaluate the significance of each node?",calculations
523,"Imagine we're choreographing an intricate dance number that involves a sequence of moves where each dancer passes a baton to the next. The dancers are positioned in a line and each move from one dancer to the next has been given a difficulty rating. We have our dancers arranged as points 0 through 4, and the moves between them with their corresponding difficulty scores are as follows: a move between dancers 0 and 1 has a difficulty of 1, between 1 and 2 is a 2, between 2 and 3 is a 3, and the move between 3 and 4 has a difficulty of 4.To ensure that our dance flows as gracefully as possible, we need to figure out the sequence of moves that results in the lowest combined difficulty score for each dancer to reach every other dancer. Using the framework of Dijkstra's algorithm, much like a choreographer would plan out the steps to minimize the risk of a misstep, could you devise a plan to determine these sequences along with the total difficulty score for each sequence? Keep in mind, we'd like to calculate these for every possible pairing in our line of dancers, ensuring the transitions are as smooth as possible.",calculations
524,"In the realm of medical research, let's say we're analyzing the spatial distribution of two potential drug compound regions within a given therapeutic landscape. Consider 'rectangle1' representing the bioavailability domain of compound A, demarcated by vertex coordinates at the molecular level of (15,15) and (30,30). Likewise, consider 'rectangle2' exemplifying the bioactivity domain of compound B, with its molecular boundary defined by vertex coordinates (25,25) and (50,50).For our analysis, it is crucial to determine whether the domains of compound A and compound B have any overlap, as this could suggest competitive interaction or synergistic potential. To ascertain this, we would typically utilize the `Rectangle.isdisjoint` function in igraph.Could you integrate this analysis into our dataset and inform us on whether the bioavailability domain of compound A is disjoint from the bioactivity domain of compound B? Please ensure the output of your analysis is conveyed effectively within our research documentation.",True/False
525,"As an Emergency Medical Dispatcher, you receive a call reporting an emergency situation in a neighborhood known for its complex road network. The caller is in need of specialized medical assistance and you need to dispatch the appropriate medical personnel to the reported location. To effectively navigate this complex road system and optimize the response, you decide to analyze the Petersen graph that models the area's road network. You need to generate the Petersen graph and provide a summary that includes the number of vertices and edges, allowing you to make well-informed decisions about dispatching the medical team and resources efficiently.",calculations
