id,question,problem_type
736,"Imagine you've set up the lighting for two separate stages, and each lighting array is meant to produce an identical visual effect based on a pre-determined pattern. Think of these patterns as 'latent positions' in a network of lights. Now, you want to check if the configurations of the two sets of lights are indeed effectively the same—even though they might have been arranged slightly differently.We can liken this to using graspologic's `latent_position_test` to verify the equivalence of these lighting patterns. Consider each stage as a random dot product graph with its own arrangement of lights (nodes). To ensure we're comparing the patterns accurately, we would employ the 'ase' method to metaphorically 'adjust' our viewpoint to analyze each setup properly before drawing any conclusions. We treat this analysis like a 'rotation' test case, mimicking the process of looking at the stages from all angles to be comprehensive in our assessment.Now, in technical terms, we set the scene: we've decided to run this comparison with 500 'rehearsals'—or in statistical jargon, 500 bootstrap simulations—to be statistically confident in our results. Once we've run our test, we'll get two critical pieces of feedback—the 'statistic', which is like a score of how different the light arrangements are, and the 'p-value', which tells us if the differences we see could just be by chance, or if they're significant enough to say that the arrangements are indeed different. This would be similar to having a director reviewing the lighting setups across rehearsals to ensure consistency in each performance.",calculations
737,"As a Regulatory Affairs Specialist, you are responsible for ensuring compliance with regulations and standards in industries such as healthcare or finance. In this role, you may be tasked with identifying specific connections between different components of a system, similar to how the `get_eid` function in igraph allows for the identification of edge IDs in a graph. For example, you may need to determine the regulatory compliance relationship between specific components in a healthcare network to ensure adherence to industry standards and regulations.",calculations
738,"As a Physician Assistant I often utilize various forms of data during patient consultations. Now, suppose I have an unique patient database, structured similarly to a graph with a singular link connecting two data points, 'A' and 'B'. I would like to share this data with fellow healthcare professionals, possibly through interactive JavaScript documents or APIs. So, how could I convert this graph into a node-link data representation that is compatible with JSON serialization, to facilitate the sharing process efficiently?",calculations
739,"As a Smart Home Designer, given a layout plan of a residential property with IoT devices and sensors connected in a network, how can you analyze the efficiency of the network by calculating the betweenness centrality for all devices, taking into account only directed paths with a maximum length of 3 hops using the networkx Python library?",calculations
740,"As a media buyer strategizing on how to allocate advertising resources for maximum impact, imagine you're evaluating a network of interconnected advertising venues represented by the connections between various key market sectors. Picture this network as an undirected graph with relationships defined as follows: 'A' represents the first market sector connected to 'B', the second sector. Then 'B' is linked to 'C', C to D, A directly to D, and B also connects to D. In order to efficiently distribute our advertising budget, we need to analyze the potential traffic on each connection, akin to determining the ""load"" these edges can bear in terms of passing along our marketing message.Could we use the same principles for computing the edge load centrality for each connection in our market sector graph—treating the sector interconnections ('A'-'B', 'B'-'C', 'C'-'D', 'A'-'D', and 'B'-'D') as edges—in order to optimize our ad spend? This could provide a clearer picture of which connections are most crucial for disseminating information throughout the network and, in turn, help us target our investments more effectively.",calculations
741,"As a lepidopterist, imagine you're studying the intricate patterns of interaction within a community of five different butterfly species in a localized habitat. You've constructed an ecological network resembling a wheel, where each node represents one butterfly species, and edges denote symbiotic relationships. To better understand this network's structure and dynamics, you wish to transform it into a chordal graph, a form where every cycle of four or more species has a chord, which is an edge that is not part of the cycle but connects two nodes of the cycle.Could you guide me on how one would emulate this process using NetworkX's 'complete_to_chordal_graph' function? Furthermore, I am keen to investigate the resultant chordal graph's symbiotic connections (i.e., edges) and discern an optimal sequence for species elimination that minimizes the impact on the network's harmony. How would one extract this information post-transformation?",calculations
742,"As an Art Therapist, you often work with clients who are looking to express themselves and navigate their emotions through artistic activities. Today, you are tasked with using a specialized tool called NetworkX Canvas to create a visual representation of a client's journey through a therapeutic process. The client's path includes moving from one point to another, each connected by specific capacities denoting their progress. How can you effectively map out this journey, ensuring that the starting point and desired destination are clearly defined within the NetworkX Canvas tool, thus aiding the client in visualizing their therapeutic progress through a directed graph format in DIMACS style?",calculations
743,"As a Life Cycle Assessment Specialist, you've been tasked with analyzing the environmental impacts of a new manufacturing process. To assist in your assessment, you need to represent the process as a network graph, where each node represents a stage of production and each edge signifies a transition between stages. However, to make this analysis more comprehensive, you also need to assign specific attributes to each edge, such as color and weight, to denote certain characteristics of the transitions.Now, utilizing the igraph library's Graph class constructor, you must create an undirected cycle graph with 5 vertices, symbolizing the 5 stages of production in your process. Each of the 5 corresponding edges should be labeled with distinct colors and weights, reflecting different aspects of the transitions between production stages. Additionally, ensure to assign a name attribute to the entire graph for easy reference during your analysis. How can you achieve this using the igraph's initialization method?",calculations
744,"Imagine we're overseeing a situation not unlike managing a group of individuals transitioning back into the community. In our scenario, we're tasked with ensuring the most efficient allocation of transport resources between various checkpoints. Here, 'a' represents the starting point, perhaps a correctional facility, with a need to transport a group of -5 (indicating individuals are departing from this location), and 'd' symbolizes the community or a reintegration center that's expecting to receive a group of 5.Our logistical map involves various routes: from 'a' to 'b', from 'a' to 'c', then from both 'b' and 'c' leading to 'd'. Each route incurs different transportation costs and has certain limits on the number of individuals it can handle, a bit like the capacity for supervision a probation officer might have.To ensure that the reentry process is as cost-effective as possible, while also meeting the capacity needs of each route, how might we leverage NetworkX to calculate the minimum expense associated with moving these individuals from the facility 'a' to the reintegration center 'd'? That is, the software would help us to find the most economical path for each individual within the constraints of each transport route's capacity, much like we'd manage and monitor individuals within the constraints of their probation or parole conditions.",calculations
745,"As a Meeting Planner, let's say you are coordinating a networking event for professionals in the tech industry. You have a graph representing the attendees and their connections using graph-tool called `tech_event_graph`. Can you demonstrate the process of converting this graph to an igraph graph for easier analysis and visualization using the `from_graph_tool` function provided by the igraph library?",calculations
746,"Imagine we're in a senior living community where we want to pair volunteers with various common areas to ensure those spaces are supervised with the least amount of effort. The common areas and walking paths connecting them can be thought of as a network where each area is a node, and the paths are the edges, forming a graph. The pairings of volunteers to paths represent an oversight strategy where one volunteer can watch over two areas at once if those areas are connected by a path.Now, given the layout of our community common areas, represented by the connections between adjacent areasnamely (1, 2), (2, 3), (3, 4), (4, 1), and (1, 3)we're looking to determine the smallest number of volunteer pairings we need to ensure that every path is adequately supervised. How would we figure out the minimum number of volunteer pairings required to achieve a comprehensive supervision of the entire network of paths between these areas?",calculations
747,"As a Public Health Educator responsible for promoting public health initiatives, you have been tasked with evaluating a new tool for monitoring progress in community health programs. Utilizing the get_progress_handler method from the IDLEShell API, how can you determine if a progress handler exists in an IDLE editor window? This information is crucial for ensuring the efficient tracking and management of various health initiatives and addressing any disparities in health outcomes effectively.",calculations
748,"Imagine you are designing an interactive display that showcases the flow of customer attention across different sections of a product package. Think of each section as a node in a network, with the pathways that customers' eyes travel across as connections between these nodes. These connections, like the seams of a package, have varying strengths represented by the thickness of the line or the width of the seam, which correlate to how likely a customer is to look from one section to another.Now you have a network representing the flow of customer attention across the package, with the connections outlined as follows: between section 1 and 2 there's a seam of thickness 0.5, between section 1 and 3 it's 0.75, section 2 and 3 have a seam of strength 1.0, between section 3 and 4 it's 1.5, and finally, between section 4 and 2 the seam has a strength of 2.0.To refine the design of the packaging and optimize the customer's visual journey, you want to determine the sections that play the most critical roles in this flow of attention - akin to hubs in a network. In technical terms, you're looking to calculate the approximate current-flow betweenness centrality of each node (section), using NetworkX to simulate this flow and identify these key hubs within your design. How would you compute these values using the data provided?",calculations
749,"Imagine we're looking at the health network of a small community with 30 individuals, where the likelihood of any two individuals having a connection (akin to an interaction or a relationship) is 5%. This network is like a representation of who might share health advice or influence with whom. Now, the community is naturally splitting into three groups where individuals 0 to 5 share a strong bond, as do individuals 6 to 10. The rest of the individuals form another distinctive group.If we were to analyze this community's network to understand how well these groups stand in terms of internal interaction versus external interaction (similar to how we evaluate the effectiveness of a treatment plan within distinct patient demographics), I need to calculate two measures of this community division: ""coverage"" - to gauge the proportion of interactions within the groups compared to the total network, and ""performance"" – which would tell us how many interactions are taking place strictly within these groups versus across different groups.Could we apply data analysis tools to compute these metrics, which are like an indicator of the community's health in terms of social cohesion? This would help us in mirroring these concepts back to our healthcare domain, providing insights similar to assessing the impact of a preventive healthcare strategy within segmented patient groups.",calculations
750,"Imagine you're crafting an intricate design for a grand wedding, where each flower's placement is like a directed pathway in a garden maze. Your goal is to create a layout where the paths are as opulent as possible, with each turn representing a choice of bloom that contributes to the overall splendor of the design. In essence, you're mapping out a grand guided tour of the garden, ensuring each guest’s journey through the arrangements is of the highest aesthetic value.Your design is based on a blueprint, which can be likened to a weighted directed graph. The connections in this blueprint are as follows: a path from the 'Amaranthus' arrangement to the 'Bougainvillea' has a beauty score of 3, the path leading from 'Amaranthus' to 'Chrysanthemum' detracts by a beauty score of -5, and so forth. To be precise, the edge set that outlines the foundation for your design is as follows: [('Amaranthus', 'Bougainvillea', 3), ('Amaranthus', 'Chrysanthemum', -5), ('Bougainvillea', 'Chrysanthemum', 1), ('Chrysanthemum', 'Amaranthus', 3), ('Chrysanthemum', 'Daffodil', 2), ('Daffodil', 'Bougainvillea', -4)].Your task is to determine the most magnificent pathway sequence that one can follow, ensuring the visual impact is the highest sum of beauty scores possible. To accomplish this, you would employ a strategy akin to the Edmonds algorithm, known for finding the maximum spanning arborescence in the world of network analysis – in your case, this would be the supreme layout for your flower arrangements.When you present your final majestic design, ensure to highlight the choices made at each stage with the corresponding beauty score, solidifying the richness of the experience through your garden maze of floral marvels.",calculations
751,"As a radiation therapist, you would typically administer radiation treatments to cancer patients using various techniques and equipment. You might work with linear accelerators, brachytherapy, or intensity-modulated radiation therapy (IMRT) to destroy or shrink tumors, prevent cancer growth or recurrence, or alleviate cancer symptoms or pain.In the context of networkx, you could potentially encounter a scenario where you need to analyze the connectivity of a directed graph representing patient treatment data. For example, you might want to identify the incoming edges to a specific vertex in the graph to better understand the treatment plan for a particular patient. This could involve using functions such as `in_edges` in networkx to retrieve and analyze the incoming edges of a specific vertex within the treatment graph.",calculations
752,"As a Computer Systems Analyst, I have been tasked with scrutinizing the structure and interconnectedness of a network delineated within the 'graph18.gml' file. A focal point of my assessment involves distinguishing edges that serve as linkages between discrete clusters or communities within the network's topology. This demarcation is pivotal for recognizing the inter-community communication pathways and potentially improving network integrity and performance.To facilitate this evaluation, the use of the 'crossing' function from the igraph library offers a method to programmatically determine whether a given edge indeed bridges separate clusters. The output from this investigation should be meticulously documented, providing a clear correspondence between each edge and its community-crossing status.The objective is to generate a report, structured in Python code comments, that articulates the relationship between each edge and communal boundaries as follows:```pythonfor idx, edge in enumerate(g.es):    print(f""Edge {edge.tuple} crosses communities: {crossing_edges[idx]}"")```Here, 'g.es' represents the enumeration of edges within the graph, and 'crossing_edges' holds a list of boolean values indicating whether the respective edges traverse between clusters. The completion of this analysis will yield insights into the architecture of the network, supporting informed decisions on optimization and enhancements moving forward.",True/False
753,"Imagine you're tasked with inspecting a network of flight routes represented as connections between airports. The network is described by flight paths connecting airport 'A' to 'B', 'B' to 'C', 'C' to 'D', 'D' to 'A', and a direct route from 'A' to 'C'. To determine if it's possible to conduct a thorough inspection tour that takes off from one airport and lands back at the same spot without retracing any flight path, we'd need to evaluate if the network forms an Eulerian circuit. Can you assess this using the is_eulerian function from the networkx toolkit and affirm if the entire network can be inspected in one seamless journey? Please provide a simple 'True' or 'False' indication corresponding to your findings. For this assessment, consider the details of the network's flight paths as key data to input into the function.",True/False
754,"As a project coordinator, I can assist in coordinating the processing of a DIMACS minimum-cost flow format file named flow_network.dimacs, which contains information about a network graph, a source node, a target node, and edge capacities. The task involves using a suitable library or tool, such as NetworkX in Python, to calculate and print the maximum flow from the specified source to the target node.",calculations
755,"As a personal trainer, you're focused on tailoring fitness programs to meet the unique needs of your clients, guiding them toward their health and fitness goals, and providing ongoing support and motivation. Imagine you're working with a group of individuals who are looking to improve their overall health through a community fitness program. Now, let's say you have access to a specialized tool called the ""Community Fitness Analyzer"" API. This tool allows you to analyze the collaboration network among participants in the program to identify clusters of individuals who share similar fitness interests and goals. One of the advanced algorithms available through this API is the Fuzzy-Rough Community Detection on Fuzzy Granular model of Social Network (FRC-FGSN) algorithm. Using this algorithm, you can perform fuzzy node clustering to identify groups within the community that exhibit varying degrees of interconnectedness based on their fitness preferences and interactions. Once the clustering analysis is complete, you can generate a JSON representation of the resulting FuzzyNodeClustering object, providing valuable insights into the community's structure and dynamics.",calculations
756,"As a journalist investigating a network of authors of books about US politics, suppose you have obtained the data representing the social network graph from a GML file called ""polbooks.gml"". You now aim to utilize the Louvain algorithm to identify distinct communities within this network. Furthermore, your task involves computing the Z-modularity score to evaluate the effectiveness of the community detection process in uncovering meaningful relationships among the authors.(Note: The Z-modularity is a modified metric that addresses the resolution limit problem often encountered in traditional modularity calculations, providing a more accurate assessment of community structure within a network.)",calculations
757,"As a journalist investigating the latest developments in community detection methods for social network analysis, I've come across an interesting scenario involving a graph with the following edge set: [(0, 1), (1, 2), (2, 3), (3, 0), (0, 4), (4, 1)]. I'm now exploring how to use the `compare_communities` function in networkx to compare two different community structures using the Normalized Mutual Information (NMI) method. This comparison would shed light on the extent of overlap and agreement between the identified community structures within the network, providing valuable insights for my research and article on this topic.",calculations
758,"As an environmental activist, you're working with a network of 500 interconnected organizations, each with a 30% likelihood of collaborating with any other. Your goal is to identify a group of 50 organizations particularly influential in this network based on their degree of collaboration. Using the ""DegreeBasedSampler"" tool, you want to sample a sub-network highlighting the 50 most central organizations based on their collaborative connections. Finally, you need to identify and record the names of these influential organizations within the sampled sub-network.",calculations
759,"As a forester managing a vast wooded expanse, you might think of the different areas of the forest as interconnected points, much like a network. Imagine that you have five principal regions of interest in your forest, labeled from 0 to 4, each connected by paths that are not equally traversable, due to varying terrain difficulty or distance. For instance, the path from region 0 to region 1 has a difficulty score of 4, while the path from region 1 to region 2 has a score of 2, and so on, with the following set of scores for each path: ((0,1,4), (1,2,2), (2,3,3), (3,4,1), (1,3,5)).Your task is to optimize your route to ensure the most efficient traversal from the base region (0) to every other key region within the forest, keeping in mind the variable difficulty of each path segment. Using a computing tool that employs NetworkX's 'single_source_bellman_ford_path' algorithm, how could we plot the most effective paths from the base region to the rest without exhausting resources unnecessarily? This will allow you to maintain a balance between conservation and forest activities across different regions while adhering to ecological best practices.",calculations
760,"Imagine we are developing a virtual reality simulation of a small city, where the connections between various points of interest are represented as pathways with varying levels of difficulty to traverse. Our nodes 'A', 'B', 'C', and 'D' represent these points of interest, and we need to determine how centrally located each one is within our network for an efficient navigation system. The pathways connecting our points of interest have different traversal costs associated with them: the path from 'A' to 'B' costs 2 units of energy, 'B' to 'C' costs 3 units, 'C' to 'A' costs 1 unit, and 'C' to 'D' costs 4 units.For the AI characters navigating this virtual space, we want to assess their efficiency moving within the city by calculating the current-flow closeness centrality of each point of interest, using the 'lu' solver to handle the underlying linear systems. How would this computation affect the centrality values for each point or node, and thereby influence the AI's navigation decisions? Integrating these centrality calculations could improve the fluidity and realism of the simulation.",calculations
761,"Imagine we are studying a complete graph, a fully connected network, consisting of 5 vertices. For each vertex within this mathematical structure, we aim to determine its generalized degree. The generalized degree, in this context, refers to the count of connections of a given node to subgraphs of a certain type, for instance, triangles.Now, let us take vertex 0 as a specific point of interest. To enhance our understanding of its role within the network, we seek to calculate the precise number of triangles it is associated with. This can be inferred from the generalized degree of vertex 0.In our investigation, we do not merely look at the immediate connections but extend our analysis to the triadic relationships it partakes in. How do we extract the count of triangles linked to vertex 0 from its generalized degree within this complete graph, keeping in mind the intricate relationships between vertices in such a densely connected topology?",calculations
762,"As a network researcher, you are working on a project to understand the connectivity patterns in a complex chemical interaction network. You have generated an Erd≈ës-R√©nyi graph with 10 nodes and 20 edges to represent the interactions between different chemicals. Now, you want to apply the Large Graph Layout (LGL) algorithm from the igraph library to visualize this network on a 2D plane and obtain the coordinates for each chemical node. Can you provide the coordinates for each vertex after applying the LGL algorithm?",calculations
